{
  "request_id": "req_2026_02_16_001",
  "as_of_date": "2026-02-16",
  "currency": "USD",
  "method": "comps_ev_revenue",
  "subject": {
    "company_id": "SUBJ-001",
    "company_name": "Acme Cloud Systems",
    "sector": "Application Software",
    "revenue_ltm": 500.0
  },
  "comps_selection": {
    "universe": "global_software",
    "filters": {
      "sector": ["Application Software"],
      "size": ["mid"],
      "industry_keywords": ["software"],
      "geographies": ["US", "CA"],
      "revenue_band": {
        "min": 200.0,
        "max": 1000.0
      }
    },
    "max_comps": 5,
    "sort_key": ["ticker", "company_id"]
  },
  "provider_overrides": {
    "comps_provider": "mock_v1"
  },
  "assumptions": {
    "outlier_policy": "winsorize",
    "outlier_quantile": 0.1,
    "quantile_method": "nearest_rank"
  },
  "config": {
    "engine_version": "0.2.0",
    "rounding_decimals": 2
  }
}
